{
  "schema": "urn:ai-friends:schema:agent:v1:policy-decision",
  "decision_id": "7a2e3d4c-5b6a-4c9d-8e1f-2a3b4c5d6e7f",
  "request_id": "6f1d2c3b-4a59-4b8c-9d0e-1f2a3b4c5d6e",
  "trace_id": "a1b2c3d4e5f60718a1b2c3d4e5f60718",
  "evaluated_at": "2026-08-30T10:00:00Z",
  "evaluator": {
    "kind": "service",
    "id": "service:af-policy"
  },
  "policy_version": {
    "version": "3.4.1",
    "digest": "sha256:a1b2c3d4e5f60718293a4b5c6d7e8f90a1b2c3d4e5f60718293a4b5c6d7e8f90",
    "signature": {
      "alg": "Ed25519",
      "key_id": "policy-signing-2026q3",
      "value": "c2FtcGxlLXNpZ25hdHVyZS1ub3QtYS1yZWFsLWtleS1wb2xpY3ktLS0tLS0tLS0tLS0tLS0tLS0tLS0tLS0tLQ"
    }
  },
  "decision": "allow_with_approval",
  "reasons": [
    {
      "code": "approval_required",
      "detail": "Выполнение команды на цели подтверждается оператором.",
      "rule_id": "exec-requires-approval"
    }
  ],
  "matched_rules": [
    "exec-requires-approval",
    "machine-grant-lab"
  ],
  "effective_constraints": {
    "deadline_seconds": 60,
    "max_output_bytes": 65536,
    "require_supervisor_present": true,
    "record_session": true,
    "allow_untrusted_provenance": false
  },
  "obligations": [
    {
      "type": "record_session"
    },
    {
      "type": "limit_output_bytes",
      "limit": 65536
    },
    {
      "type": "single_use_token"
    },
    {
      "type": "notify_approver"
    }
  ],
  "ttl_seconds": 120,
  "risk": "high",
  "required_approval": {
    "policy": "always",
    "min_approver_role": "approver",
    "ttl_seconds": 300,
    "distinct_from_actor": true,
    "presentation": "afrender/1"
  },
  "fail_mode": "closed"
}
