{
  "schema": "urn:ai-friends:schema:agent:v1:policy-decision",
  "decision_id": "7a2e3d4c-5b6a-4c9d-8e1f-2a3b4c5d6e70",
  "request_id": "d08e9da2-b120-43f3-a475-8091021324ac",
  "trace_id": "b2c3d4e5f6071829b2c3d4e5f6071829",
  "evaluated_at": "2026-08-30T10:06:00Z",
  "evaluator": {
    "kind": "service",
    "id": "service:af-policy"
  },
  "policy_version": {
    "version": "3.4.1",
    "digest": "sha256:a1b2c3d4e5f60718293a4b5c6d7e8f90a1b2c3d4e5f60718293a4b5c6d7e8f90",
    "signature": {
      "alg": "Ed25519",
      "key_id": "policy-signing-2026q3",
      "value": "c2FtcGxlLXNpZ25hdHVyZS1ub3QtYS1yZWFsLWtleS1wb2xpY3ktLS0tLS0tLS0tLS0tLS0tLS0tLS0tLS0tLQ"
    }
  },
  "decision": "deny",
  "reasons": [
    {
      "code": "protected_path",
      "detail": "Запрошенный путь выходит за пределы корня после канонизации.",
      "rule_id": "path-containment"
    },
    {
      "code": "containment_violation",
      "rule_id": "path-containment"
    }
  ],
  "matched_rules": [
    "path-containment"
  ],
  "ttl_seconds": 60,
  "risk": "high",
  "fail_mode": "closed"
}
